{
  "command": "python3 -m unittest discover -s tests && bash scripts/test_shiki_evidence_integrity.sh && bash scripts/test_shiki_guardian_policy.sh && bash scripts/test_shiki_control_plane.sh && bash scripts/test_shiki_governance_evidence.sh && python3 scripts/validate_shiki.py --target .",
  "created_at": "2026-08-05T01:08:04+00:00",
  "goal_id": "G-20260801T041653272590Z-81f6f71d",
  "id": "EXEC-20260805T010804513806Z-f5bae99d",
  "returncode": 0,
  "stderr": "............................................................................................................................................................................................................................................................................................................................................................................................................................................................................................................................................................................................................................................................................................................................................................................................................................................................................................................................................................................\n----------------------------------------------------------------------\nRan 940 tests in 83.330s\n\nOK\n",
  "stdout": "Guardian approval status for PR #130 (mizutani-140/shiki)\nHead SHA: aaaaaaaaaaaaaaaaaaaaaaaaaaaaaaaaaaaaaaaa\nResult: NOT APPROVED\n\nSatisfied approval sources:\n  - guardian_label (by mizutani-140)\n\nMissing / what the gate is waiting for:\n  - Guardian approval requires a configured Guardian review or current-head Guardian comment\n\nHead SHA stability:\n  - clean: safe to request approval against this head SHA\n\nPaste-ready Guardian approval comment (a configured Guardian pastes this verbatim):\n----------8<----------\nGuardian approval granted\n\naaaaaaaaaaaaaaaaaaaaaaaaaaaaaaaaaaaaaaaa\n---------->8----------\n{\n  \"handoff_file\": \"/private/var/folders/z7/g8_sl74j3qd3k4_zjkdt_w340000gn/T/tmp9hwfs6h2/repo/.shiki/handoffs/RP-20260805T010720160467Z-9077c30c-repair.md\",\n  \"ledger_id\": \"L-20260805T010720177587Z-f3cc838c\",\n  \"repair_id\": \"RP-20260805T010720160467Z-9077c30c\"\n}\n{\n  \"handoff_file\": \"/private/var/folders/z7/g8_sl74j3qd3k4_zjkdt_w340000gn/T/tmputyr213a/repo/.shiki/handoffs/RP-20260805T010722208923Z-0b0e70ba-repair.md\",\n  \"ledger_id\": \"L-20260805T010722225709Z-597d1392\",\n  \"repair_id\": \"RP-20260805T010722208923Z-0b0e70ba\"\n}\n{\n  \"handoff_file\": \"/private/var/folders/z7/g8_sl74j3qd3k4_zjkdt_w340000gn/T/tmp5cz3qwav/repo/.shiki/handoffs/RP-20260805T010723274432Z-f74fa8e2-repair.md\",\n  \"ledger_id\": \"L-20260805T010723292027Z-4c1afdb4\",\n  \"repair_id\": \"RP-20260805T010723274432Z-f74fa8e2\"\n}\n{\n  \"handoff_file\": \"/private/var/folders/z7/g8_sl74j3qd3k4_zjkdt_w340000gn/T/tmp1npqon51/repo/.shiki/handoffs/RP-20260805T010734486893Z-00b90071-repair.md\",\n  \"ledger_id\": \"L-20260805T010734504969Z-e46a444f\",\n  \"repair_id\": \"RP-20260805T010734486893Z-00b90071\"\n}\n{\n  \"handoff_file\": \"/private/var/folders/z7/g8_sl74j3qd3k4_zjkdt_w340000gn/T/tmpqrpuh30m/repo/.shiki/handoffs/RP-20260805T010736458020Z-7be1c2f3-repair.md\",\n  \"ledger_id\": \"L-20260805T010736475569Z-e6618cce\",\n  \"repair_id\": \"RP-20260805T010736458020Z-7be1c2f3\"\n}\n{\n  \"handoff_file\": \"/private/var/folders/z7/g8_sl74j3qd3k4_zjkdt_w340000gn/T/tmpqg14hmy0/repo/.shiki/handoffs/RP-20260805T010736881637Z-efbb8811-repair.md\",\n  \"ledger_id\": \"L-20260805T010736898500Z-ede3b136\",\n  \"repair_id\": \"RP-20260805T010736881637Z-efbb8811\"\n}\n{\n  \"handoff_file\": \"/private/var/folders/z7/g8_sl74j3qd3k4_zjkdt_w340000gn/T/tmpubcapqf5/repo/.shiki/handoffs/RP-20260805T010737353849Z-6af4bf29-repair.md\",\n  \"ledger_id\": \"L-20260805T010737371582Z-cf4f4816\",\n  \"repair_id\": \"RP-20260805T010737353849Z-6af4bf29\"\n}\n[shiki] token verified: ok\n[shiki] token verified: ok\n{\n  \"repo\": \"owner/name\",\n  \"secret\": \"CLAUDE_CODE_OAUTH_TOKEN\",\n  \"source\": \"env:SHIKI_TEST_TOK\",\n  \"verified\": true\n}\nevidence manifest and ledger helper fixtures passed\nshiki evidence integrity tests passed\nguardian policy evaluator fixtures passed\ncontract approval end-to-end carry fixtures passed\nguardian status base-sync carry fixtures passed\nshiki guardian policy tests passed\nShiki validation passed\nShiki validation passed\nShiki validation passed\nshiki control-plane tests passed\ngovernance evidence adversarial fixtures passed\nShiki validation passed\n",
  "task_id": "T-20260801T041653274008Z-54d3477c"
}
