{
  "command": "claude -p --permission-mode bypassPermissions <.shiki/handoffs/T-20260806T084356215508Z-7a7dd694-task.md>",
  "created_at": "2026-08-07T01:41:30+00:00",
  "goal_id": "G-20260806T084356214001Z-8198f059",
  "id": "EXEC-20260807T014130245388Z-bedf843d",
  "returncode": 0,
  "stderr": "",
  "stdout": "Implementation is complete and verified. Handing back to the Shiki loop for delivery (I have not committed, pushed, or opened a PR \u2014 those are loop-owned).\n\n## Result\n- Goal/task: G-20260806T084356214001Z-8198f059 / T-20260806T084356215508Z-7a7dd694\n- Role: Implementer (Claude Code, ADR 0008)\n- Status: **complete** (implementation + tests green; awaiting loop delivery \u2192 CCA \u2192 MergeGate)\n\n## What changed\n- **`scripts/shiki_tasks.py`** \u2014 added `cmd_lock_release` (the deliberate counterpart to `cmd_lock_acquire`) + `FINISHED_TASK_STATUSES`. It is the *authority* for a release: decides \"finished\" from the task record (terminal status `done` only \u2014 I discovered \"retired/abandoned/superseded\" aren't real statuses; the motivating \"retired\" task is actually `planned`), refuses an unfinished task naming the task and its status, treats an already-released lock as a no-op success, refuses a missing/unreadable record naming the path, and **marks** the record (`state\u2192released` + `released_by`/`released_at` alongside the acquisition fields) rather than deleting it. Record shape + JSON result contract mirror acquire.\n- **`scripts/shiki_cli.py`** \u2014 imported `cmd_lock_release` and wired the `release` child into the `lock` subparser (mirrors `acquire`: `--target`, `--owner`, `task_id`).\n- **`tests/test_lock_release.py`** \u2014 11 unit tests (TDD): finished-release records the releaser; result contract mirrors acquire; released paths acquirable by a different task; unfinished refused (all 6 non-terminal statuses); missing/unreadable refused naming path; already-released no-op (fresh + re-run); dispatch and status-promotion never release; and a drift-guard binding `FINISHED_TASK_STATUSES` to `validate_shiki.TERMINAL_TASK_STATUSES`.\n- **`scripts/test_shiki_control_plane.sh`** \u2014 self-contained end-to-end block proving the property unit tests can't: a DIFFERENT task acquires the SAME paths after release (blocked-before, granted-after), plus a validation-pass-never-releases assertion. Cleans up all temp task/lock/ledger files before the closing `validate_shiki`.\n\n## Checklist status\n- Skill Gate: `tdd` (red\u2192green\u2192refactor), `code-review` (self-review of diff \u2014 mirrors acquire, no scope drift)\n- TDD: new tests failed for the right reason, then passed\n- CCA/MergeGate: loop-owned (not run by implementer)\n\n## Evidence\n- `python3 -m unittest discover -s tests` \u2192 **1102 tests, OK**\n- `scripts/test_shiki_control_plane.sh` \u2192 **passed** (exit 0)\n- `scripts/test_shiki_goal_loop.sh` \u2192 **passed** (exit 0)\n- `python3 scripts/validate_shiki.py` \u2192 **Shiki validation passed**\n- `py_compile` on both edited scripts \u2192 OK\n- Scope: only the 4 locked files changed; `scripts/shiki_loop.py` unchanged; no real lock record touched (the `M .shiki/tasks/\u20267a7dd694.json` / `?? .shiki/locks/\u20267a7dd694.json` are loop-owned state present at session start)\n\n## Next action\n- Shiki goal loop owns commit/push/PR (with MergeGate body)/merge. No implementer action remains.\n",
  "task_id": "T-20260806T084356215508Z-7a7dd694"
}
