{
  "command": "claude -p --permission-mode bypassPermissions <.shiki/handoffs/T-20260618T093119138788Z-867546d0-task.md>",
  "created_at": "2026-06-18T09:32:44+00:00",
  "goal_id": "G-20260618T093112319886Z-a4f768c5",
  "id": "EXEC-20260618T093244375965Z-3c87bb89",
  "returncode": 0,
  "stderr": "",
  "stdout": "The new file is untracked (so `git diff HEAD` is empty by design); the review scope is `tests/test_loop_smoke3.py`, which I just wrote.\n\n**Review (proportionate to scope):**\n- **Correctness:** Single test asserts `2 * 3 == 6` \u2014 trivially true, passes (confirmed by the green run, all 285 tests `OK`).\n- **Collection/collision:** Class `LoopSmoke3Tests` and module name are unique vs. `test_loop_smoke.py`/`test_loop_smoke2.py` \u2014 no discovery shadowing.\n- **No production code touched;** change is confined to `tests/**` (within declared locks).\n- **Style parity:** docstring, `from __future__ import annotations`, `unittest.TestCase`, `test_smoke` method, and `__main__` guard match both siblings exactly.\n\nNo findings \u2014 `[]`. Nothing to repair.\n\nI'm now done with my assigned scope. Per the execution protocol, I will **not** commit, push, or open a PR \u2014 the Shiki goal loop owns delivery.\n\n## Result\n- Goal/task: G-20260618T093112319886Z-a4f768c5 / T-20260618T093119138788Z-867546d0\n- Role: Implementer (Claude Code)\n- Status: complete (implementation; awaiting loop-owned MergeGate/CCA)\n\n## What changed or decided\n- Added `tests/test_loop_smoke3.py`: one self-contained `unittest.TestCase` (`LoopSmoke3Tests.test_smoke`) asserting `2 * 3 == 6`, matching the two existing smoke-test siblings.\n\n## Checklist status\n- Skill Gate: `tdd` (trivial \u2014 test *is* the deliverable), `code-review` (run, no findings)\n- PRD/issues: n/a (trivial test addition, loop-driven)\n- TDD: test file is the artifact; passes on collection\n- CCA: pending (loop/GitHub-owned)\n- MergeGate: pending (loop-owned commit/push/PR/merge)\n\n## Evidence\n- Checks: `python3 -m unittest discover -s tests -v` \u2192 `Ran 285 tests`, `OK`; `test_loop_smoke3.LoopSmoke3Tests.test_smoke ... ok` collected and passing\n- Review/CCA: code-review on diff \u2192 no findings (`[]`)\n- Branch: shiki/t-20260618t093119138788z-867546d0-add-a-third-trivial-smoke-test\n- Scope: only `tests/test_loop_smoke3.py` (within locks `path:tests/**`)\n\n## Next action\n- Shiki goal loop to commit, push, open the PR with the MergeGate body, and run CCA/MergeGate.\n",
  "task_id": "T-20260618T093119138788Z-867546d0"
}
