{
  "command": "claude -p --permission-mode bypassPermissions <.shiki/handoffs/T-20260731T004111132162Z-bfcf2c9e-task.md>",
  "created_at": "2026-07-31T01:20:03+00:00",
  "goal_id": "G-20260731T004111130646Z-0dbace30",
  "id": "EXEC-20260731T012003321054Z-03d235ba",
  "returncode": 0,
  "stderr": "",
  "stdout": "All green, only the four locked files changed. The implementation is complete.\n\n## Result\n- **Goal/task:** G-20260731T004111130646Z-0dbace30 / T-20260731T004111132162Z-bfcf2c9e \u2014 derive the bookkeeping-closeout Guardian exemption (ADR 0017) in MergeGate\n- **Role:** Implementer (TDD + code-review)\n- **Status:** ready \u2014 with one companion wiring change flagged (see Next action)\n\n## What changed\n- **`scripts/mergegate_check.py`** \u2014 added `is_bookkeeping_closeout(...)` + helper `_closeout_completes_goal(...)`, enforcing all six ADR 0017 conditions from **the diff, the base snapshot, and live PR state only** (it never reads the PR object, so a label/marker/body claim can't classify a PR). It **fails closed** on every axis (missing base snapshot, unreadable task file, unresolvable impl PR, missing DAG). The exemption is consulted at the *single* decision point: `_guardian_risk_labels(..., bookkeeping_closeout=...)` now treats a proven closeout's task as low risk, so `_builtin_guardian_risk_required` and the policy check both see it as low \u2014 every other gate runs unchanged. `merged_prs` parsing was lifted to the top of `main()` and shared with `post_merge_reconcile`.\n- **`tests/test_bookkeeping_closeout.py`** (new) \u2014 23 tests: positive completing + non-completing cases, and **every disqualifier in isolation**, each asserting the **Guardian-requirement fallback** (via the real `enforce_guardian_policy` over the repo policy *and* the decision function), not merely that the PR blocks.\n- **`scripts/test_shiki_adversarial_state.sh`** & **`scripts/test_shiki_governance_evidence.sh`** \u2014 added the six smuggling cases (non-`.shiki` file; governance-field edit; deleted mirror record; unexpected status; second scorecard; impl PR not merged) + a clean control, each asserting the specific Guardian fallback string.\n\n## Checklist status\n- **TDD:** classifier + full disqualifier matrix; **mutation-tested** \u2014 forcing the classifier always-True *and* always-False both turn the shell suites red, proving the assertions catch regressions in both directions.\n- **code-review:** self-review tightened reports/ledgers to append-only (`A`) to match the terminal-set and the repo's append-only-ledger invariant.\n- **MergeGate:** N/A locally (loop owns delivery).\n\n## Evidence\n- `validate_shiki` PASS \u00b7 Python unittest 560 PASS (incl. 23 new) \u00b7 control_plane PASS (unmodified) \u00b7 governance_evidence PASS \u00b7 adversarial_state PASS \u00b7 shellcheck PASS\n- Only the four declared locks touched.\n\n## Next action (companion change \u2014 outside this task's locks)\nThe exemption is **correct and fully tested but dormant in production**: `.github/workflows/shiki-cca-completion.yml`'s \"Enforce MergeGate\" step computes `MERGED_PRS` **only** for `post_merge_reconcile`-marked PRs, so a normal closeout gets `--merged-prs \"\"` \u2192 condition 6 (impl PR merged) fails \u2192 no exemption. To achieve the reproducibility goal (`shiki loop step` driving a high-risk closeout to merge with no Guardian approval), a follow-up task must generalize that block to resolve `<body task id> \u2192 base expected_pr \u2192 gh pr view state` for closeout PRs too (safe: `--merged-prs` is independently re-validated by both consumers). The workflow file is outside this task's locks, so I did not touch it \u2014 recorded in memory for the operator/next task.\n",
  "task_id": "T-20260731T004111132162Z-bfcf2c9e"
}
