{
  "command": "python3 -m unittest discover -s tests && bash scripts/test_shiki_goal_loop.sh && python3 scripts/validate_shiki.py --target .",
  "created_at": "2026-08-03T09:51:33+00:00",
  "goal_id": "G-20260801T040948350468Z-4a542e71",
  "id": "EXEC-20260803T095133718582Z-23242c66",
  "returncode": 0,
  "stderr": ".........................................................................................................................................................................................................................................................................................................................................................................................................................................................................................................................................................................................................................................................................................................................................................................................................................................\n----------------------------------------------------------------------\nRan 809 tests in 65.918s\n\nOK\nhint: Using 'master' as the name for the initial branch. This default branch name\nhint: will change to \"main\" in Git 3.0. To configure the initial branch name\nhint: to use in all of your new repositories, which will suppress this warning,\nhint: call:\nhint:\nhint: \tgit config --global init.defaultBranch <name>\nhint:\nhint: Names commonly chosen instead of 'master' are 'main', 'trunk' and\nhint: 'development'. The just-created branch can be renamed via this command:\nhint:\nhint: \tgit branch -m <name>\nhint:\nhint: Disable this message with \"git config set advice.defaultBranchName false\"\n",
  "stdout": "Guardian approval status for PR #130 (mizutani-140/shiki)\nHead SHA: aaaaaaaaaaaaaaaaaaaaaaaaaaaaaaaaaaaaaaaa\nResult: NOT APPROVED\n\nSatisfied approval sources:\n  - guardian_label (by mizutani-140)\n\nMissing / what the gate is waiting for:\n  - Guardian approval requires a configured Guardian review or current-head Guardian comment\n\nHead SHA stability:\n  - clean: safe to request approval against this head SHA\n\nPaste-ready Guardian approval comment (a configured Guardian pastes this verbatim):\n----------8<----------\nGuardian approval granted\n\naaaaaaaaaaaaaaaaaaaaaaaaaaaaaaaaaaaaaaaa\n---------->8----------\n{\n  \"handoff_file\": \"/private/var/folders/z7/g8_sl74j3qd3k4_zjkdt_w340000gn/T/tmprebv46a0/repo/.shiki/handoffs/RP-20260803T095105705598Z-fe442712-repair.md\",\n  \"ledger_id\": \"L-20260803T095105721718Z-884d9a76\",\n  \"repair_id\": \"RP-20260803T095105705598Z-fe442712\"\n}\n{\n  \"handoff_file\": \"/private/var/folders/z7/g8_sl74j3qd3k4_zjkdt_w340000gn/T/tmpqort9k0l/repo/.shiki/handoffs/RP-20260803T095107736737Z-68242370-repair.md\",\n  \"ledger_id\": \"L-20260803T095107753738Z-c841a829\",\n  \"repair_id\": \"RP-20260803T095107736737Z-68242370\"\n}\n{\n  \"handoff_file\": \"/private/var/folders/z7/g8_sl74j3qd3k4_zjkdt_w340000gn/T/tmp4q8e91s3/repo/.shiki/handoffs/RP-20260803T095108782433Z-6f0d0eee-repair.md\",\n  \"ledger_id\": \"L-20260803T095108799052Z-ac97f5ae\",\n  \"repair_id\": \"RP-20260803T095108782433Z-6f0d0eee\"\n}\n{\n  \"handoff_file\": \"/private/var/folders/z7/g8_sl74j3qd3k4_zjkdt_w340000gn/T/tmp3lhc4v8y/repo/.shiki/handoffs/RP-20260803T095119519262Z-637a7c02-repair.md\",\n  \"ledger_id\": \"L-20260803T095119538554Z-0df40611\",\n  \"repair_id\": \"RP-20260803T095119519262Z-637a7c02\"\n}\n{\n  \"handoff_file\": \"/private/var/folders/z7/g8_sl74j3qd3k4_zjkdt_w340000gn/T/tmpny3i4mo_/repo/.shiki/handoffs/RP-20260803T095121451461Z-3248bcf3-repair.md\",\n  \"ledger_id\": \"L-20260803T095121468932Z-11c06eb3\",\n  \"repair_id\": \"RP-20260803T095121451461Z-3248bcf3\"\n}\n{\n  \"handoff_file\": \"/private/var/folders/z7/g8_sl74j3qd3k4_zjkdt_w340000gn/T/tmpu178cl6t/repo/.shiki/handoffs/RP-20260803T095121882981Z-3d5ae295-repair.md\",\n  \"ledger_id\": \"L-20260803T095121900677Z-895c3127\",\n  \"repair_id\": \"RP-20260803T095121882981Z-3d5ae295\"\n}\n{\n  \"handoff_file\": \"/private/var/folders/z7/g8_sl74j3qd3k4_zjkdt_w340000gn/T/tmpti5l55fh/repo/.shiki/handoffs/RP-20260803T095122357540Z-02ba6e42-repair.md\",\n  \"ledger_id\": \"L-20260803T095122378656Z-fca1d7db\",\n  \"repair_id\": \"RP-20260803T095122357540Z-02ba6e42\"\n}\n[shiki] token verified: ok\n[shiki] token verified: ok\n{\n  \"repo\": \"owner/name\",\n  \"secret\": \"CLAUDE_CODE_OAUTH_TOKEN\",\n  \"source\": \"env:SHIKI_TEST_TOK\",\n  \"verified\": true\n}\nShiki validation passed\nshiki goal loop tests passed\nShiki validation passed\n",
  "task_id": "T-20260801T040948352877Z-eea16def"
}
