{
  "command": "claude -p --permission-mode bypassPermissions <.shiki/handoffs/T-20260729T065622769184Z-628504fe-task.md>",
  "created_at": "2026-07-30T01:47:28+00:00",
  "goal_id": "G-20260729T065622761503Z-4479b0d3",
  "id": "EXEC-20260730T014728106308Z-47105575",
  "returncode": 0,
  "stderr": "",
  "stdout": "All tasks complete and all suites green. Implementation finished within the declared locks. Here is the summary.\n\n## Result\n- Goal/task: G-20260729T065622761503Z-4479b0d3 / **T-20260729T065622769184Z-628504fe**\n- Role: Implementer (Claude Code)\n- Status: **ready** \u2014 implementation complete and locally verified; delivery (commit/push/PR/MergeGate) is owned by the Shiki loop.\n\n## What changed or decided\n- **`scripts/shiki_guardian_status.py`** (new): `shiki guardian status --pr N`. Runs the existing `evaluate_guardian_approval` over evidence (live `gh` by default; offline file mode for CI/tests) and reports (a) satisfied sources and by whom, (b) the exact missing blockers, (c) a paste-ready comment body carrying the policy marker + the **full 40-char** head SHA read from live PR state, and (d) a head-SHA-stability check (`detect_sha_change`) that **withholds** the approval body when an unpushed commit or unsynced `.shiki/ledger/` evidence means the SHA is about to change. Read-only: never applies a label, approves, merges, or posts.\n- **`scripts/shiki_cli.py`**: registered the `guardian status` subparser and imported `cmd_guardian_status`.\n- **`scripts/shiki_installer.py`**: added `scripts/shiki_guardian_status.py` to `TEMPLATE_PATHS` so it stages into targets (prevents `No module named shiki_guardian_status` in the target's `validate_shiki` CLI module-boundary check).\n- **`.github/workflows/shiki-cca-completion.yml`**: new `if: always()` step that, when the CCA verdict is `needs_guardian`, renders the same blockers + paste-ready body via `shiki guardian status` (offline, over already-fetched evidence) and posts/updates an idempotent PR comment (hidden `<!-- shiki:guardian-status -->` marker).\n- **`tests/test_guardian_status.py`** (new): 13 behavior tests, including a round-trip proving the printed body actually satisfies the authoritative evaluator.\n- **`scripts/test_shiki_guardian_policy.sh`**: added CLI offline-behavior assertions, a read-only grep guard, workflow-wiring assertions, and an install-target + target-`validate_shiki` check.\n\n## Checklist status\n- Skill Gate: `tdd` followed (tests \u2192 impl, run each cycle); `code-review` gate is user-triggered (`/code-review`, not model-invocable) \u2014 performed a manual review against the standard instead (no findings; changes stay within locks).\n- TDD: new suite 13/13 green; full `python3 -m unittest discover -s tests` = **515 passed**.\n- CCA/MergeGate: not run locally (GitHub-side); wiring verified via `validate_shiki` + shell-test greps.\n\n## Evidence (local, diagnostic)\n- `python3 scripts/validate_shiki.py` \u2192 passed\n- `python3 -m unittest discover -s tests` \u2192 **Ran 515, OK**\n- `test_shiki_module_boundaries.sh`, `test_shiki_workflow_lint.sh`, `test_shiki_shellcheck.sh`, `test_shiki_governance_evidence.sh` \u2192 all passed\n- `test_shiki_guardian_policy.sh` (deliberately excluded from `test_command`) \u2192 **exit 0** in this checkout, where `shiki doctor` reports `doctor.worktrees.unregistered: pass` (acceptance check 8 satisfied and recorded here)\n- install-target into a fresh temp target \u2192 module staged, target `validate_shiki` \u2192 passed, target `import shiki_cli`/`shiki_guardian_status` \u2192 OK (acceptance check 7)\n- Branch: `shiki/t-20260729t065622769184z-628504fe-...` (no commit/push/PR performed \u2014 loop owns delivery)\n\n## Next action\n- Hand back to the Shiki loop to commit, push, open the PR with the MergeGate body, and run CCA/MergeGate. This is a **risk:high** task, so merge requires Guardian approval \u2014 and this PR will exercise its own new needs_guardian comment step (the `pull_request` run uses the workflow + module from the PR head).\n\nOne note for the reviewer/loop: the runtime PR-comment post is only provable as durable CI evidence; locally I verified the rendering and the workflow wiring, not the live `gh` post.\n",
  "task_id": "T-20260729T065622769184Z-628504fe"
}
