{
  "command": "claude -p --permission-mode bypassPermissions <.shiki/handoffs/T-20260729T065622768738Z-fa978e4a-task.md>",
  "created_at": "2026-08-01T03:20:20+00:00",
  "goal_id": "G-20260729T065622761503Z-4479b0d3",
  "id": "EXEC-20260801T032020560997Z-10787868",
  "returncode": 0,
  "stderr": "",
  "stdout": "Implementation complete and verified. Handing back to the loop for delivery.\n\n## Result\n- Goal/task: G-20260729T065622761503Z-4479b0d3 / T-20260729T065622768738Z-fa978e4a\n- Role: Implementer\n- Status: **ready** (implementation done, verified; loop owns commit/push/PR/MergeGate)\n\n## What changed\nTwo defects on the `scripts/shiki_tasks.py` lock-acquisition seam (both live on PR #179):\n\n- **(a) Status preservation** \u2014 new `status_after_lock_acquire()`: only `planned`/unset \u2192 `ready`; every advanced status is preserved. Replaced the unconditional `task[\"status\"] = \"ready\"` in `try_acquire_locks` and `cmd_lock_acquire`. Stops a re-acquisition from rewinding a task with an open PR from `review` \u2192 `ready` (which MergeGate's post-CCA rule then blocked).\n- **(b) Amendment-following grants** \u2014 new `refresh_lock_grant()` and `evaluate_lock_grant()`, wired into `cmd_dispatch_check`. A Spec Amendment that widens a task's locks is now detected as a grant/contract divergence and the grant is auto-refreshed to the current contract (no manual re-acquisition). A refresh that would collide with another task's active lock is refused and reported naming **both lock sets and the owning task**, never a bare \"locks are not granted\".\n\n## Code-review gate (high-risk)\nRan an independent adversarial reviewer. It found **no correctness defect** breaking any acceptance check or non-goal. I acted on its findings:\n- **Finding 2 (fixed)** \u2014 a *passive* refresh (triggered by a readiness check) must not advance the lifecycle. Made `refresh_lock_grant` preserve status verbatim; only explicit acquisition promotes `planned\u2192ready`. Otherwise a `dispatch check` could flip a `planned` task to `ready` and the loop's planned-only `_unblock_ready_tasks` would skip it. Added a regression test that would have caught it.\n- **Finding 1 (kept, documented)** \u2014 `dispatch check` now mutates on the divergence path (grant refresh + ledger). This is intentional and constraint-driven: the grant must be refreshed before dispatch, the loop's dispatch effector is outside this task's locks, and the refresh is idempotent and recorded as durable evidence rather than a silent mutation.\n- **Finding 3** \u2014 `blocked` stays `blocked` on acquire; intentional per \"only planned may become ready\", documented.\n\n## Evidence\n- TDD: `tests/test_lock_lifecycle.py` (new, 16 tests) \u2014 RED confirmed, then GREEN; each test maps to an acceptance check.\n- Task test command `bash scripts/test_shiki_control_plane.sh && python3 -m unittest discover -s tests`: **PASS** (690\u2192 Python tests OK; added CLI-level assertions to the control-plane test).\n- All 34 `test_shiki_*.sh` PASS (incl. shellcheck, module-boundaries); `validate_shiki` passed.\n- Changes confined to the three declared locks. The task-file `status: running` and untracked lock record are the loop's own dispatch bookkeeping (present at session start), not my edits.\n- No approval records authored; no commit/push/PR/gh commands run.\n\n## Next action\n- The Shiki loop delivers commit/push/PR (with the MergeGate body) and runs CCA/MergeGate. No blockers identified on my side.\n",
  "task_id": "T-20260729T065622768738Z-fa978e4a"
}
