{
  "command": "python3 -m unittest discover -s tests",
  "created_at": "2026-06-18T09:32:55+00:00",
  "goal_id": "G-20260618T093112319886Z-a4f768c5",
  "id": "EXEC-20260618T093255462729Z-0ea33d82",
  "returncode": 0,
  "stderr": ".............................................................................................................................................................................................................................................................................................\n----------------------------------------------------------------------\nRan 285 tests in 4.063s\n\nOK\n",
  "stdout": "",
  "task_id": "T-20260618T093119138788Z-867546d0"
}
