{
  "command": "python3 -m unittest discover -s tests && bash scripts/test_shiki_goal_loop.sh && python3 scripts/validate_shiki.py --target .",
  "created_at": "2026-08-06T06:09:16+00:00",
  "goal_id": "G-20260806T034026770241Z-4f95b5bf",
  "id": "EXEC-20260806T060916562312Z-7ebf212b",
  "returncode": 0,
  "stderr": "...........................................................................................................................................................................................................................................................................................................................................................................................................................................................................................................................................................................................................................................................................................................................................................................................................................................................................................................................................................................................................................................................................................................................\n----------------------------------------------------------------------\nRan 1083 tests in 88.772s\n\nOK\nhint: Using 'master' as the name for the initial branch. This default branch name\nhint: will change to \"main\" in Git 3.0. To configure the initial branch name\nhint: to use in all of your new repositories, which will suppress this warning,\nhint: call:\nhint:\nhint: \tgit config --global init.defaultBranch <name>\nhint:\nhint: Names commonly chosen instead of 'master' are 'main', 'trunk' and\nhint: 'development'. The just-created branch can be renamed via this command:\nhint:\nhint: \tgit branch -m <name>\nhint:\nhint: Disable this message with \"git config set advice.defaultBranchName false\"\n",
  "stdout": "Guardian approval status for PR #130 (mizutani-140/shiki)\nHead SHA: aaaaaaaaaaaaaaaaaaaaaaaaaaaaaaaaaaaaaaaa\nResult: NOT APPROVED\n\nSatisfied approval sources:\n  - guardian_label (by mizutani-140)\n\nMissing / what the gate is waiting for:\n  - Guardian approval requires a configured Guardian review or current-head Guardian comment\n\nHead SHA stability:\n  - clean: safe to request approval against this head SHA\n\nPaste-ready Guardian approval comment (a configured Guardian pastes this verbatim):\n----------8<----------\nGuardian approval granted\n\naaaaaaaaaaaaaaaaaaaaaaaaaaaaaaaaaaaaaaaa\n---------->8----------\n{\n  \"handoff_file\": \"/private/var/folders/z7/g8_sl74j3qd3k4_zjkdt_w340000gn/T/tmp9yryj1bf/repo/.shiki/handoffs/RP-20260806T060837354232Z-bc153b1f-repair.md\",\n  \"ledger_id\": \"L-20260806T060837368286Z-563a4f36\",\n  \"repair_id\": \"RP-20260806T060837354232Z-bc153b1f\"\n}\n{\n  \"handoff_file\": \"/private/var/folders/z7/g8_sl74j3qd3k4_zjkdt_w340000gn/T/tmpbkksdvg3/repo/.shiki/handoffs/RP-20260806T060839598071Z-574aeccc-repair.md\",\n  \"ledger_id\": \"L-20260806T060839611981Z-79aded29\",\n  \"repair_id\": \"RP-20260806T060839598071Z-574aeccc\"\n}\n{\n  \"handoff_file\": \"/private/var/folders/z7/g8_sl74j3qd3k4_zjkdt_w340000gn/T/tmp8ybfmkt4/repo/.shiki/handoffs/RP-20260806T060841400149Z-06c929d4-repair.md\",\n  \"ledger_id\": \"L-20260806T060841419673Z-aa9a47cc\",\n  \"repair_id\": \"RP-20260806T060841400149Z-06c929d4\"\n}\n{\n  \"handoff_file\": \"/private/var/folders/z7/g8_sl74j3qd3k4_zjkdt_w340000gn/T/tmp7dqz6mkc/repo/.shiki/handoffs/RP-20260806T060854025654Z-e049ad98-repair.md\",\n  \"ledger_id\": \"L-20260806T060854039412Z-4a77bdb2\",\n  \"repair_id\": \"RP-20260806T060854025654Z-e049ad98\"\n}\n{\n  \"handoff_file\": \"/private/var/folders/z7/g8_sl74j3qd3k4_zjkdt_w340000gn/T/tmptqi4rrnd/repo/.shiki/handoffs/RP-20260806T060856605509Z-7117859c-repair.md\",\n  \"ledger_id\": \"L-20260806T060856619614Z-1ecdef97\",\n  \"repair_id\": \"RP-20260806T060856605509Z-7117859c\"\n}\n{\n  \"handoff_file\": \"/private/var/folders/z7/g8_sl74j3qd3k4_zjkdt_w340000gn/T/tmps8_j765a/repo/.shiki/handoffs/RP-20260806T060856962796Z-38885835-repair.md\",\n  \"ledger_id\": \"L-20260806T060856976670Z-429cff08\",\n  \"repair_id\": \"RP-20260806T060856962796Z-38885835\"\n}\n{\n  \"handoff_file\": \"/private/var/folders/z7/g8_sl74j3qd3k4_zjkdt_w340000gn/T/tmpmre_ic94/repo/.shiki/handoffs/RP-20260806T060857779595Z-e2202265-repair.md\",\n  \"ledger_id\": \"L-20260806T060857793640Z-08bf06b0\",\n  \"repair_id\": \"RP-20260806T060857779595Z-e2202265\"\n}\n[shiki] token verified: ok\n[shiki] token verified: ok\n{\n  \"repo\": \"owner/name\",\n  \"secret\": \"CLAUDE_CODE_OAUTH_TOKEN\",\n  \"source\": \"env:SHIKI_TEST_TOK\",\n  \"verified\": true\n}\nShiki validation passed\nshiki goal loop tests passed\nShiki validation passed\n",
  "task_id": "T-20260806T034026771634Z-52142739"
}
